{
  "schema_name": "OwnerAdaptationRunV1",
  "schema_version": "1.0.0",
  "record_id": "adaptation-synthetic-v1",
  "adaptation_id": "synthetic-owner-adaptation-v1",
  "workspace_id": "workspace-synthetic-academy",
  "base_package_id": "synthetic-base-v1",
  "candidate_package_id": "synthetic-candidate-v1",
  "training_sample_ids": ["synthetic-train-001", "synthetic-train-002"],
  "heldout_sample_ids": ["synthetic-heldout-001"],
  "distinct_training_sessions": 2,
  "approved_examples": 30,
  "annotation_minutes": 40,
  "training_wall_seconds": 300,
  "training_cost_usd": 0,
  "owner_metric_before": {"name": "tol_f1", "value": 0.6, "unit": "ratio", "stratum": "owner-heldout"},
  "owner_metric_after": {"name": "tol_f1", "value": 0.7, "unit": "ratio", "stratum": "owner-heldout"},
  "common_ruler_delta": {"name": "tol_f1_delta", "value": -0.01, "unit": "ratio", "stratum": "common-ruler"},
  "correction_minutes_per_source_hour_before": 20,
  "correction_minutes_per_source_hour_after": 12,
  "overlap_check_passed": true,
  "decision": "rejected",
  "decision_authority": "owner",
  "notes": "Synthetic example: the human may reject a candidate despite an owner-ruler lift."
}
